{
 "as_of": "2026-10-16T00:35:22Z",
 "last_curate_at": "2026-10-15T02:39:20Z",
 "new_since_last_curate": [],
 "items": [
  {
   "id": "95f76cf97a73",
   "company": "STGW",
   "title": "Stagwell (STGW) Closes the AI-Marketing Execution Gap with ServiceNow",
   "url": "https://www.stagwellglobal.com/stagwell-stgw-closes-the-ai-marketing-execution-gap-with-servicenow/",
   "published": "2026-10-14",
   "summary": null,
   "category": "other",
   "flagged": false,
   "source": "stagwell:rss",
   "fetched_at": "2026-10-16T00:35:32Z"
  },
  {
   "id": "7ae508b0f7c5",
   "company": "DENTSU",
   "title": "Dentsu Wins Six Awards at the 2026 APAC Effie Awards",
   "url": "https://www.group.dentsu.com/en/news/release/001765.html",
   "published": "2026-10-14",
   "summary": "Dentsu (Headquarters: Dentsu Group Inc.; Location: Minato-ku, Tokyo; President & Global CEO: Takeshi Sano) was awarded a total of six awards at the 2026 APAC Effie Awards, held in Singapore on September 25, 2026. The APAC Effie Awards recognize the most e",
   "category": "other",
   "flagged": false,
   "source": "dentsu:rss",
   "fetched_at": "2026-10-16T00:35:31Z"
  },
  {
   "id": "78b9483ea266",
   "company": "DENTSU",
   "title": "Carat - Difference Engineered - Explored in Campaign Exclusive Interview with Chrissie Hanson",
   "url": "https://www.carat.com/thoughts-and-views/carat-difference-engineered-explored-in-campaign-exclusive-interview-with-chrissie-hanson",
   "published": "2026-10-14",
   "summary": "Dentsu has doubled down on agency brands with Carat\u2019s new positioning, \u201cDifference Engineered\u201d.",
   "category": "other",
   "flagged": false,
   "source": "dentsu:rss",
   "fetched_at": "2026-10-16T00:35:31Z"
  },
  {
   "id": "585dbe9fb6c1",
   "company": "HAVAS",
   "title": "Havas reports solid Net Revenue growth of +7.2% in Q3 2026, driven by organic growth and contribution from acquisitions",
   "url": "https://www.havas.com/press_release/havas-reports-solid-net-revenue-growth-of-7-2-in-q3-2026-driven-by-organic-growth-and-contribution-from-acquisitions/",
   "published": "2026-10-14",
   "summary": null,
   "category": "results",
   "flagged": true,
   "source": "havas:rss",
   "fetched_at": "2026-10-16T00:35:30Z"
  },
  {
   "id": "1bb092e1a0a7",
   "company": "WPP",
   "title": "WPP appoints Adam Gerhart as Global Chief Client Officer",
   "url": "https://www.wpp.com/en/news/wpp-appoints-adam-gerhart-as-global-chief-client-officer",
   "published": "2026-10-14",
   "summary": null,
   "category": "leadership",
   "flagged": false,
   "source": "wpp:html",
   "fetched_at": "2026-10-16T00:35:29Z"
  },
  {
   "id": "db14ad96cb54",
   "company": "PUB",
   "title": "Publicis Groupe: Third Quarter 2026 Revenue",
   "url": "https://www.publicisgroupe.com/en/news/press-releases/publicis-groupe-third-quarter-2026-revenue",
   "published": "2026-10-13",
   "summary": null,
   "category": "results",
   "flagged": true,
   "source": "publicis:html",
   "fetched_at": "2026-10-16T00:35:26Z"
  },
  {
   "id": "b2e3cdcdb93a",
   "company": "HAVAS",
   "title": "Havas liquidity program documents",
   "url": "https://www.havas.com/press_release/havas-liquidity-program-documents/",
   "published": "2026-10-12",
   "summary": null,
   "category": "other",
   "flagged": false,
   "source": "havas:rss",
   "fetched_at": "2026-10-16T00:35:30Z"
  },
  {
   "id": "c08bbae62c81",
   "company": "STGW",
   "title": "Stagwell Schedules Webcast to Discuss Financial Results for the Three and Nine Months Ended September 30, 2026",
   "url": "https://www.stagwellglobal.com/stagwell-schedules-webcast-to-discuss-financial-results-for-the-three-and-nine-months-ended-september-30-2026/",
   "published": "2026-10-08",
   "summary": null,
   "category": "results",
   "flagged": true,
   "source": "stagwell:rss",
   "fetched_at": "2026-10-16T00:35:32Z"
  },
  {
   "id": "ad93fb8e7260",
   "company": "WPP",
   "title": "WPP appoints Tyler Turnbull as CEO of WPP Creative",
   "url": "https://www.wpp.com/en/news/wpp-appoints-tyler-turnbull-as-ceo-of-wpp-creative",
   "published": "2026-10-08",
   "summary": null,
   "category": "leadership",
   "flagged": false,
   "source": "wpp:html",
   "fetched_at": "2026-10-16T00:35:29Z"
  },
  {
   "id": "12952fe67735",
   "company": "STGW",
   "title": "Stagwell Launches New Global Media Agency, Stagwell Media",
   "url": "https://www.stagwellglobal.com/stagwell-launches-new-global-media-agency-stagwell-media/",
   "published": "2026-10-08",
   "summary": null,
   "category": "other",
   "flagged": false,
   "source": "stagwell:rss",
   "fetched_at": "2026-10-16T00:35:32Z"
  },
  {
   "id": "7474d3e50179",
   "company": "HAVAS",
   "title": "Havas\u2019 near-term science-based emissions reduction targets validated by the Science Based Targets initiative",
   "url": "https://www.havas.com/press_release/havas-near-term-science-based-emissions-reduction-targets-validated-by-the-science-based-targets-initiative/",
   "published": "2026-10-06",
   "summary": null,
   "category": "other",
   "flagged": false,
   "source": "havas:rss",
   "fetched_at": "2026-10-16T00:35:30Z"
  },
  {
   "id": "3f99adf8cde0",
   "company": "DENTSU",
   "title": "Dentsu Wins 12 Awards at the D&AD Awards 2026 Including \u201cDesign Agency of the Year\u201d for Dentsu Inc.",
   "url": "https://www.group.dentsu.com/en/news/release/001762.html",
   "published": "2026-10-06",
   "summary": "Dentsu (Headquarters: Dentsu Group Inc.; Location: Minato-ku, Tokyo; President & Global CEO: Takeshi Sano) was awarded a total of 12 awards (\u201cpencils\u201d) at the D&AD Awards 2026, the international advertising awards held in London on September 24. The award",
   "category": "other",
   "flagged": false,
   "source": "dentsu:rss",
   "fetched_at": "2026-10-16T00:35:31Z"
  },
  {
   "id": "2309f22cebf8",
   "company": "DENTSU",
   "title": "Dentsu Signs First Virtual PPAs in Japan for Japan\u2019s Advertising Industry",
   "url": "https://www.group.dentsu.com/en/news/release/001760.html",
   "published": "2026-10-06",
   "summary": "Dentsu (Brand: dentsu; Headquarters: Dentsu Group Inc.; Location: Minato-ku, Tokyo; President & Global CEO: Takeshi Sano) has signed two Virtual Power Purchase Agreements (Virtual PPAs) for its Japan operations: one with HEXA Renewables Japan Co., Ltd. (H",
   "category": "other",
   "flagged": false,
   "source": "dentsu:rss",
   "fetched_at": "2026-10-16T00:35:31Z"
  },
  {
   "id": "cebd0b78c3d6",
   "company": "DENTSU",
   "title": "TBS and dentsu Jointly Establish Pro Pickleball Team \u201cTHE DOTS TOKYO\u201d to Compete in Asia\u2019s Premier League MLP Asia 2026",
   "url": "https://www.group.dentsu.com/en/news/release/001758.html",
   "published": "2026-10-05",
   "summary": "TBS Holdings, Inc. (Head Office: Minato-ku, Tokyo; President & Chief Executive Officer: Ryujiro Abe) and Dentsu Group (Headquarters: Dentsu Group Inc.; Location: Minato-ku, Tokyo; President & Global CEO: Takeshi Sano) announced that TBS and dentsu Sports",
   "category": "other",
   "flagged": false,
   "source": "dentsu:rss",
   "fetched_at": "2026-10-16T00:35:31Z"
  },
  {
   "id": "06a4289965e7",
   "company": "HAVAS",
   "title": "Havas share buyback documents",
   "url": "https://www.havas.com/press_release/havas-share-buyback-documents/",
   "published": "2026-10-05",
   "summary": null,
   "category": "other",
   "flagged": false,
   "source": "havas:rss",
   "fetched_at": "2026-10-16T00:35:30Z"
  },
  {
   "id": "d5afd027ec2e",
   "company": "PUB",
   "title": "Publicis Groupe - Invitation - Third Quarter 2026 Revenue",
   "url": "https://www.publicisgroupe.com/en/news/press-releases/publicis-groupe-invitation-third-quarter-2026-revenue",
   "published": "2026-10-02",
   "summary": null,
   "category": "results",
   "flagged": true,
   "source": "publicis:html",
   "fetched_at": "2026-10-16T00:35:26Z"
  },
  {
   "id": "bd14c1014f56",
   "company": "WPP",
   "title": "Jon Cook to leave WPP and transition VML CEO role to long-time partner Eric Campbell",
   "url": "https://www.wpp.com/en/news/jon-cook-to-leave-wpp-and-transition-vml-ceo-role-to-long-time-partner-eric-campbell",
   "published": "2026-10-02",
   "summary": null,
   "category": "leadership",
   "flagged": false,
   "source": "wpp:html",
   "fetched_at": "2026-10-16T00:35:29Z"
  },
  {
   "id": "f8797be619d5",
   "company": "STGW",
   "title": "September Harvard Caps / Harris Poll: Democrats Hold A 2-Point Lead Among Likely Voters in Midterms Horserace, With Trump Approval Hitting a Low Of 42%",
   "url": "https://www.stagwellglobal.com/september-harvard-caps-harris-poll-democrats-hold-a-2-point-lead-among-likely-voters-in-midterms-horserace-with-trump-approval-hitting-a-low-of-42/",
   "published": "2026-09-30",
   "summary": null,
   "category": "other",
   "flagged": false,
   "source": "stagwell:rss",
   "fetched_at": "2026-10-16T00:35:32Z"
  },
  {
   "id": "994cb93de8f2",
   "company": "HAVAS",
   "title": "Havas enters into liquidity agreement to support stock liquidity",
   "url": "https://www.havas.com/press_release/havas-enters-into-liquidity-agreement-to-support-stock-liquidity/",
   "published": "2026-09-30",
   "summary": null,
   "category": "other",
   "flagged": false,
   "source": "havas:rss",
   "fetched_at": "2026-10-16T00:35:30Z"
  },
  {
   "id": "2a83ccf60e48",
   "company": "DENTSU",
   "title": "DENTSU CREATIVE 2026 CMO REPORT: MAKING IT REAL",
   "url": "https://www.dentsucreative.com/campaigns/dentsu-creative-cmo-report-2026",
   "published": "2026-09-30",
   "summary": "DENTSU CREATIVE 2026 CMO REPORT",
   "category": "other",
   "flagged": false,
   "source": "dentsu:rss",
   "fetched_at": "2026-10-16T00:35:31Z"
  },
  {
   "id": "032233977436",
   "company": "OMC",
   "title": "Omnicom Recognized As a Leader in Two 2026 Gartner Reports for Global Digital Marketing Agencies",